0,1468574812,Tue Apr 07 02:30:13 PDT 2009,NO_QUERY,retorta,"@andrerib Oh, today it is not possible for me  Family matters, but i will try to attend next !"
0,1468574970,Tue Apr 07 02:30:16 PDT 2009,NO_QUERY,sadeburnett,gd mornin world. i hav a cold.. my throat is burnin! 
0,1468575290,Tue Apr 07 02:30:21 PDT 2009,NO_QUERY,yazza9,Morning people. Away to get some breakfast and then sort myself out and then must start on HWm no lazing about today  Xx
0,1468575292,Tue Apr 07 02:30:21 PDT 2009,NO_QUERY,LDelphian,Guess I should go to bed... Have to be up in 5.5 hours... haven't been able to sleep lately too stressed about website not being done yet 
0,1468575547,Tue Apr 07 02:30:26 PDT 2009,NO_QUERY,wakeuphate,@aventure That's windows for you... I get to deal with about 20 windows servers and 180 windows machines misbehaving every day..  shoot me
0,1468575633,Tue Apr 07 02:30:28 PDT 2009,NO_QUERY,jnjr83,@babyvtec geez it's so late for you!! Good luck at work tomorrow  I am soooo knackered too. Love you!
0,1468575832,Tue Apr 07 02:30:32 PDT 2009,NO_QUERY,RedVelvetHeart,"just been given ma marching orders, gotta go do some work, yay.........  "
0,1468576197,Tue Apr 07 02:30:38 PDT 2009,NO_QUERY,shutupstupidho,@DanaEatsYou   hahaha im sorry  i didnt mean to. and you're supposed to film the day of silly! thats cheating doing it the day before!
0,1468576909,Tue Apr 07 02:30:52 PDT 2009,NO_QUERY,scorpiolady1,"@DonnieWahlberg Wise words but life sometimes doesn't work out as you plan, life has a habit of kicking you when you're down. "
0,1468577526,Tue Apr 07 02:31:03 PDT 2009,NO_QUERY,abby_behappy,Gosh  It is raining in summer cause of the global warming?
0,1468577939,Tue Apr 07 02:31:12 PDT 2009,NO_QUERY,Lani_bears,@Pigman i love the cooler trenchcoat weather!! but DNW the darker evenings as it's scary to run at night 
0,1468577950,Tue Apr 07 02:31:12 PDT 2009,NO_QUERY,punkie331, i close my eyes nd i see your face..:/ whens it gonna stop? ::sigh times 5::
0,1468578020,Tue Apr 07 02:31:14 PDT 2009,NO_QUERY,rebekahthornton,I have packed off hubby to Bristol! Missing him already 
0,1468578118,Tue Apr 07 02:31:15 PDT 2009,NO_QUERY,jorja_xoxo,Doing homework 
0,1468578189,Tue Apr 07 02:31:17 PDT 2009,NO_QUERY,AviiS,@HopeOk but i will be soon.  -dies-
0,1468578405,Tue Apr 07 02:31:22 PDT 2009,NO_QUERY,l_brown,"@rustyrockets I'll give you a fiver towards the fine - not much, but Im skint from paying for  Al Darlings eyebrow waxing "
0,1468578466,Tue Apr 07 02:31:23 PDT 2009,NO_QUERY,DonMcAllister,"Hmm, A request for me to feature an app on my site from a &quot;Merketing Specialist&quot; (sic) addressed to &quot;Dear Editor!&quot;  Oh dear "
0,1468578538,Tue Apr 07 02:31:24 PDT 2009,NO_QUERY,risha_,@nishitd NO!  I missed everything.. 1/4 onwards. Stupid work getting in the way of tennis.  
0,1468578704,Tue Apr 07 02:31:27 PDT 2009,NO_QUERY,nick730,Thought this being a 4-day week would make Tuesday more bearable. I was wrong 
0,1468578809,Tue Apr 07 02:31:30 PDT 2009,NO_QUERY,joanneeadie,I'm more tired than a very tired thing today. 
0,1468579125,Tue Apr 07 02:31:37 PDT 2009,NO_QUERY,mr_trick,@Mark_Mulligan Exactly! That was the core of my concept for Virgin. Just a shame the money ran out before we could realise it 
0,1468579507,Tue Apr 07 02:31:46 PDT 2009,NO_QUERY,spikylau,@jonathanchong I could do with a long week 
0,1468579783,Tue Apr 07 02:31:51 PDT 2009,NO_QUERY,ian_si,"@ambermatson Yes, seems to have been much worse than normal over past few months "
0,1468580108,Tue Apr 07 02:31:58 PDT 2009,NO_QUERY,sarahearles,just found the most gorgeous pair of vintage dior sunglasses... they are �125 though 
0,1468580924,Tue Apr 07 02:32:14 PDT 2009,NO_QUERY,Tittch,"I am a work martyr. Give me chocolate, coffee and sympathy. And now my cat's decided she's dying "
0,1468580990,Tue Apr 07 02:32:16 PDT 2009,NO_QUERY,carenduff,"nothing much, not well, in bed all day!!! "
0,1468581148,Tue Apr 07 02:32:19 PDT 2009,NO_QUERY,ReekRude,Looking at the rain fall in Rotterdam.. 
0,1468581218,Tue Apr 07 02:32:21 PDT 2009,NO_QUERY,AmieSC,@eoghanquigg wish i could but i'm no where near belfast  -- love the new song btw!
0,1468582130,Tue Apr 07 02:32:41 PDT 2009,NO_QUERY,privateStatic,fever has started  anyone have any miracle cures for a cold?
0,1468582346,Tue Apr 07 02:32:46 PDT 2009,NO_QUERY,mercuryvapour,"I have just really, really splattered the bowl "
0,1468582414,Tue Apr 07 02:32:47 PDT 2009,NO_QUERY,MissNina,Why do most videos i play skip and jump 
0,1468582630,Tue Apr 07 02:32:53 PDT 2009,NO_QUERY,hayleyclaudia,is hungover  and just wants to stay in bed all day ?
0,1468582636,Tue Apr 07 02:32:53 PDT 2009,NO_QUERY,lexusperplexus,I just set up a Twitter profile for one of my colleagues and noticed he's got a much more swish sidebar - how do I get that? 
0,1468582817,Tue Apr 07 02:32:57 PDT 2009,NO_QUERY,smilinglauz,Had a great 21st birthday but is sick as with the flu 
0,1468582825,Tue Apr 07 02:32:57 PDT 2009,NO_QUERY,alfonsostreet,@fromthestars I WANNA GO TO AN AMUSEMENT PARK.  EK is getting tired. :|
0,1468582858,Tue Apr 07 02:32:57 PDT 2009,NO_QUERY,Wilkopops,"Just had myself as driving lesson, went pretty well.  Need to stop crossing my hands over on the wheel apparently though, bad times "
0,1468583130,Tue Apr 07 02:33:04 PDT 2009,NO_QUERY,ChefShaneFrisco,"Found a nice lake-side park with a small beach, but . . . no grills   Oh well . . . I'll have to keep looking - another time."
0,1468583468,Tue Apr 07 02:33:10 PDT 2009,NO_QUERY,maddihorse,@billbeckett Did you know tai means shit in indonesian. 
0,1468583796,Tue Apr 07 02:33:18 PDT 2009,NO_QUERY,miss_rini,"is dreading tomorrow   I HATE hospitals, especially when it's your baby that is the patient."
0,1468583816,Tue Apr 07 02:33:18 PDT 2009,NO_QUERY,Chadwyn28,not feeling so hot 
0,1468584115,Tue Apr 07 02:33:25 PDT 2009,NO_QUERY,jamieyork,"@jedi58 Yup. The whole game was amazing technically, it looked great. Gutted I sold the game and my original Xbox now actually. "
0,1468584621,Tue Apr 07 02:33:36 PDT 2009,NO_QUERY,bloodyorme,is not looking forward to working today 
0,1468584756,Tue Apr 07 02:33:39 PDT 2009,NO_QUERY,scorpiolady1,"Blooming great, change of weather now I have a cold, just my luck, don't seem to be having much luck lately... life sucks at the mo "
0,1468585401,Tue Apr 07 02:33:54 PDT 2009,NO_QUERY,andyroser24,@playandstay Well i've actually only been to Thorpe Park   So I'm sooo looking forward to Alton Towers!
0,1468585560,Tue Apr 07 02:33:57 PDT 2009,NO_QUERY,gabbyortanez,WANTS TO GO OUT BADLY 
0,1468586391,Tue Apr 07 02:34:16 PDT 2009,NO_QUERY,timd6156,this is way to early to go to work 
0,1468586841,Tue Apr 07 02:34:25 PDT 2009,NO_QUERY,Micc_x,@bradiewebbstack sway sway tour in julyyyyy! exitedd muchh  follow me pleaseeee? i need more followerss 
0,1468587360,Tue Apr 07 02:34:36 PDT 2009,NO_QUERY,0ppro,Living on Neurofen for another day. Please go away headache. 
0,1468587896,Tue Apr 07 02:34:49 PDT 2009,NO_QUERY,joshua_love,is gonna start revising for exams in May 
0,1468587917,Tue Apr 07 02:34:49 PDT 2009,NO_QUERY,vindiekins,@LadyErlynne awwww.  you could always post in the Transfig classroom with Sharmila
0,1468588126,Tue Apr 07 02:34:54 PDT 2009,NO_QUERY,laceylingerie,I have to go to the library and get some books on the bloody was  I really can't be bothered with these A levels anymore
0,1468588643,Tue Apr 07 02:35:04 PDT 2009,NO_QUERY,jessbabiixxx,nothinn  nothings on tv  maybe they've run out of programs
0,1468588836,Tue Apr 07 02:35:07 PDT 2009,NO_QUERY,savagestar,"@RetraceLady @djslump Morning! Oh no, more of them?  #terremoto #earthquake #italy"
0,1468589177,Tue Apr 07 02:35:16 PDT 2009,NO_QUERY,frances90,is seriously wondering what the Australian public were thinking by kicking my baby Kat off of SYTYCD!  I miss her already...
0,1468589198,Tue Apr 07 02:35:16 PDT 2009,NO_QUERY,themestup,so today is apparently cuddle up day. and i have no one to cuddle up with. 
0,1468589510,Tue Apr 07 02:35:21 PDT 2009,NO_QUERY,laz18,@erickaaa im at workkkk  im freezing too i need a mass hug from you! can i call u 2night babe? xxx
0,1468589811,Tue Apr 07 02:35:27 PDT 2009,NO_QUERY,VinoGlocal,"@Winetweat: sorry  but follow us, we're going to publish pictures and video and sometimes also in english"
0,1468590276,Tue Apr 07 02:35:37 PDT 2009,NO_QUERY,whatevermort,"@quinparker I find that, in this age of internettery, this is how you perfectly express sorrow and empathy for another's pain "
0,1468590417,Tue Apr 07 02:35:40 PDT 2009,NO_QUERY,ConorWinders,ARGH finally figured out whats killing 'Inquizitor' games on Jailbroken devices. About 30 1 star reviews too late though!  Fix on the way
0,1468590446,Tue Apr 07 02:35:41 PDT 2009,NO_QUERY,Morledge,"Considering new business name, which means new logo and website. Finding it very difficult to pick a name though. Been 2 weeks  #fail"
0,1468590687,Tue Apr 07 02:35:46 PDT 2009,NO_QUERY,manish_khatri,Office time.!! 
0,1468590883,Tue Apr 07 02:35:50 PDT 2009,NO_QUERY,jennsbookshelf,@beatccr I can't wait to read that one...still waiting on my copy 
0,1468591226,Tue Apr 07 02:35:57 PDT 2009,NO_QUERY,taniajannoun,having lunch on my desk while i work 
0,1468591243,Tue Apr 07 02:35:58 PDT 2009,NO_QUERY,harissamin,wants an iphone 
0,1468591556,Tue Apr 07 02:36:04 PDT 2009,NO_QUERY,rheaaa,ITS APRIL! STOP SNOWING!!! 
0,1468591774,Tue Apr 07 02:36:09 PDT 2009,NO_QUERY,GGKintyre,Trying to find the motivation to write some essays and finding it sad that my life revolves around essay writing 
0,1468592035,Tue Apr 07 02:36:14 PDT 2009,NO_QUERY,zompzwin,I heard he stopped singing.  It's a shame� ? http://blip.fm/~3xath
0,1468592042,Tue Apr 07 02:36:14 PDT 2009,NO_QUERY,nunoncastors,@theletterj Couldn't agree more. People keep stealing my elastic band ball 
0,1468592279,Tue Apr 07 02:36:19 PDT 2009,NO_QUERY,Pobbles,Stuck inside...poorly little people 
0,1468592501,Tue Apr 07 02:36:24 PDT 2009,NO_QUERY,thriftymom,@MizFitOnline Is ur host down? I'm getting nothin' 
0,1468592622,Tue Apr 07 02:36:26 PDT 2009,NO_QUERY,megilicious,@lyn_ thanks hun.. didnt even no he was going to be on... pitty we couldnt see him sing 
0,1468593185,Tue Apr 07 02:36:39 PDT 2009,NO_QUERY,paulrjmellors,@myrtti  ouch
0,1468593281,Tue Apr 07 02:36:41 PDT 2009,NO_QUERY,steeley,"I'm all snuffly and then hot and cold, tired and bunged up.  Woe is me "
0,1468593463,Tue Apr 07 02:36:45 PDT 2009,NO_QUERY,AmyGrindhouse,"Just a heads up. Site's being wonky, so will like probably post late today. Flippin technical issues. "
0,1468593660,Tue Apr 07 02:36:50 PDT 2009,NO_QUERY,maddyks,@skinnylatte its a great article but quite sad. We are the saddest pinnacle of evolution 
0,1468593773,Tue Apr 07 02:36:52 PDT 2009,NO_QUERY,ThisIsOurs_info,Goodbye Jive test server - so very sorry to have to shut you down 
0,1468594081,Tue Apr 07 02:36:59 PDT 2009,NO_QUERY,RockChick182,I'm up  amy's coming around today so i have to clean my room 
0,1468594652,Tue Apr 07 02:37:11 PDT 2009,NO_QUERY,galopp,finishing the tax return... instead of making some tracks or enjoying the sun... 
0,1468594996,Tue Apr 07 02:37:18 PDT 2009,NO_QUERY,kao_ami,be offline 
0,1468595084,Tue Apr 07 02:37:20 PDT 2009,NO_QUERY,peta_davies,hoping my new kitten is well - as she isn't eating or drinking - hopefully just stress of a new place 
0,1468595095,Tue Apr 07 02:37:20 PDT 2009,NO_QUERY,cwkong2,@danielhcwong Taylor 814ce --&gt; #&amp;$(#&amp;$!(@#$(!@#*$(#!( sweet mother of #@&amp;$(!@#($*(!@#*$(!@#&amp;$(!@#$&amp;!(@#!#@($... my livie is only 2900 
0,1468595182,Tue Apr 07 02:37:22 PDT 2009,NO_QUERY,lyditriz,@elltotheice poor kid  damn all those people who want to cut there grass �__� ahaha! 15days&lt;3
0,1468595283,Tue Apr 07 02:37:25 PDT 2009,NO_QUERY,rotekatze,"I'm wish I wouldn't have drank coffee all day long, need sleep, must sleep, can't sleep "
0,1468595297,Tue Apr 07 02:37:25 PDT 2009,NO_QUERY,Buzzyboo,"is feeling even worse..  cold, cough, sore throat.. the works "
0,1468595850,Tue Apr 07 02:37:38 PDT 2009,NO_QUERY,awtribute,"finally have the vintage logo of greatness over here now...kinda tough to do right now w/o a home computer  ... oh well, someday"
0,1468596073,Tue Apr 07 02:37:43 PDT 2009,NO_QUERY,sarahroters,is feeling weird today. happy and sad at the same time. and missing my people from italy  ilyyy &lt;3
0,1468596208,Tue Apr 07 02:37:47 PDT 2009,NO_QUERY,xcool,"argh, there goes my plans for Friday... "
0,1468596693,Tue Apr 07 02:37:57 PDT 2009,NO_QUERY,Katy_Louise,@heidimontag : i dont know im in the UK so isn't out here yet  so jealous
0,1468596885,Tue Apr 07 02:38:01 PDT 2009,NO_QUERY,iNickyy,got formal invitation. what am i gonna do about my date? i should've said to put &quot;Nick &amp; Guest&quot;. 
0,1468596927,Tue Apr 07 02:38:03 PDT 2009,NO_QUERY,Molecat84,ande now I'm not sure I want to associate with such a violet product  may have a re-think about my screen name
0,1468596929,Tue Apr 07 02:38:02 PDT 2009,NO_QUERY,lexaah,@markhardy1974 it IS but i'm still waiting for my ride  #itm
0,1468597269,Tue Apr 07 02:38:09 PDT 2009,NO_QUERY,jesscocaine,wish the sun would shine more.  i have a cute yellow dress to wear. COME ON SUN. COME OUT AND PLAY. stupid england.
0,1468598037,Tue Apr 07 02:38:26 PDT 2009,NO_QUERY,JaceChannel5,"well, my foot odor problem is def. back!  hmph. "
0,1468598198,Tue Apr 07 02:38:31 PDT 2009,NO_QUERY,theguru42,The drawback to this is that every picture I take with my phone is broadcast and is sent with the file name as text.  #AutomationAtaCost
0,1468598341,Tue Apr 07 02:38:34 PDT 2009,NO_QUERY,kittencaboodle,"@petemc they're horrible, they're out to get me "
0,1468598385,Tue Apr 07 02:38:34 PDT 2009,NO_QUERY,Mike_Laverick,dontcha just love microsoft corrupted open XML documents. 
0,1468598459,Tue Apr 07 02:38:36 PDT 2009,NO_QUERY,Simonerose,i have fucking shin splints!!!! im in pain.....DRUGS PLEASE......i never realised they could be so painful 
0,1468598518,Tue Apr 07 02:38:37 PDT 2009,NO_QUERY,clareedwards,@taratomes I applied to go on that - but my Dad wouldn't drive me to Manchester for the auditions 
0,1468598811,Tue Apr 07 02:38:44 PDT 2009,NO_QUERY,SterlingHug,I have no idea how to use twitter.  No one wants to follow me cause I'm a bland person.
0,1468598817,Tue Apr 07 02:38:44 PDT 2009,NO_QUERY,djodcouk,@helenthornber I dunno but I used to get fruitsalads and blackjacks from the post office...we never got applejacks tho 
0,1468598987,Tue Apr 07 02:38:48 PDT 2009,NO_QUERY,RockChick182,My best friend Amy is coming round today to i've got to clean the house  and i've got to find my amp cable
0,1468599110,Tue Apr 07 02:38:50 PDT 2009,NO_QUERY,Aashrey,where is my phone &amp; good foods? aaaaaaaaah  
0,1468599213,Tue Apr 07 02:38:53 PDT 2009,NO_QUERY,PhantomV48,"The Muppet Whatnot Workshop site is temporarily down, apparently totally sold out &quot;Working hard to get it back ASAP&quot;  Hurry up, y'all. "
0,1468599415,Tue Apr 07 02:38:58 PDT 2009,NO_QUERY,ednaiscool51,ednaiscool51 is up again yay! but all my videos are gone 
0,1468599754,Tue Apr 07 02:39:06 PDT 2009,NO_QUERY,achmadsirman,"@James_yeah gah, poor illazilla and shame about the mutt  but best of luck  this time around!"
0,1468599846,Tue Apr 07 02:39:07 PDT 2009,NO_QUERY,DanielMiller89,@iB3nji Yeh i know but it wasnt on the showbags list in the paper the other day  I heard that they are broadcasting from the show on Thurs
0,1468599980,Tue Apr 07 02:39:11 PDT 2009,NO_QUERY,Meryl_F,@alexfoster  re cat. Prob have amazing effect on vet bills too?  Watch for changes in character of remaining cat-puss!
0,1468600060,Tue Apr 07 02:39:12 PDT 2009,NO_QUERY,Lingkan_bella,NEED UUUUUUUUUUUUUU.....  http://plurk.com/p/n0vpg
0,1468600221,Tue Apr 07 02:39:15 PDT 2009,NO_QUERY,EMILYstack,"@sonnyjoeflangan goddammit, i missed it  what 3 songs? xx"
0,1468600337,Tue Apr 07 02:39:18 PDT 2009,NO_QUERY,izzy4u,"@CatQ was so thinking of you, family and friends. Glad you're okay! But It's a black day for Italy, with all those people killed. "
0,1468600466,Tue Apr 07 02:39:21 PDT 2009,NO_QUERY,TatiLav,Just had a great time... that is if I forget about the fight on the way back... 
0,1468600978,Tue Apr 07 02:39:32 PDT 2009,NO_QUERY,DramaQueenx,Horrible Weather 
0,1468601090,Tue Apr 07 02:39:34 PDT 2009,NO_QUERY,learningforevil,@DavidBlue someone spoiled it for me last week 
0,1468601271,Tue Apr 07 02:39:39 PDT 2009,NO_QUERY,wyndwitch,@nicsknots  What up?
0,1468601402,Tue Apr 07 02:39:43 PDT 2009,NO_QUERY,ammaryasir,"cant eat, drink or breath thanks to the bad throat infection "
0,1468602199,Tue Apr 07 02:40:02 PDT 2009,NO_QUERY,ammaryasir,"cant eat, drink or breath properly thanks to the bad throat infection "
0,1468602417,Tue Apr 07 02:40:04 PDT 2009,NO_QUERY,AliceMary92,Shattered 
0,1468602461,Tue Apr 07 02:40:05 PDT 2009,NO_QUERY,pinguprue,'s nanna just passed away 
0,1468602936,Tue Apr 07 02:40:14 PDT 2009,NO_QUERY,Dionza,Having delay to 1500 
0,1468602988,Tue Apr 07 02:40:15 PDT 2009,NO_QUERY,carrotmadman6,Uni sucks! Have to leave home at 12:00 to attend a lecture at 14:30 to 16:30.  &amp; roadworks everywhere - MT installing fibre cables.
0,1468603079,Tue Apr 07 02:40:18 PDT 2009,NO_QUERY,WannaBeKoola,"Started his 12 week training, it's going tobbr tough with so many birthdays, currently at work    http://twitpic.com/2y81k"
0,1468603209,Tue Apr 07 02:40:20 PDT 2009,NO_QUERY,Tittch,It's so upsetting. Ami's in agony and the vet can't see her until 6pm. My poor little thing 
0,1468603408,Tue Apr 07 02:40:24 PDT 2009,NO_QUERY,kassy4,"@matthewknight i don't know...! I can ping the site, but it won't load at all for me...  I'm trying to contact dreamhost "
0,1468603974,Tue Apr 07 02:40:36 PDT 2009,NO_QUERY,megastar85,no body ever replys to me 
0,1468604390,Tue Apr 07 02:40:46 PDT 2009,NO_QUERY,appleplex,"@edbehrens 'Thanks for all the good luck! Alas, I wasn't good enough  don't really want to explain but thanks for everything I &lt;3 you all'"
0,1468604795,Tue Apr 07 02:40:54 PDT 2009,NO_QUERY,Barbieash,cannot stop coughing  so much for sleeeping
0,1468604810,Tue Apr 07 02:40:55 PDT 2009,NO_QUERY,paperclipface,Wet hair in my eyes. 
0,1468605010,Tue Apr 07 02:40:59 PDT 2009,NO_QUERY,nadiaparry,"@kevatkinson My bro and sis but very young, mums working today so thought i would help out... I don't have any sun "
0,1468605370,Tue Apr 07 02:41:07 PDT 2009,NO_QUERY,RealRicola,"having a coffee and going through my twitter, facebook and other social networks ..... it seems to become a full time job to keep up "
0,1468605376,Tue Apr 07 02:41:07 PDT 2009,NO_QUERY,Nicolaarthur,gets to speak to my boyfriend til about 3! so happy! but then cant speak to him til may! that may hurt a little!! 
0,1468606175,Tue Apr 07 02:41:25 PDT 2009,NO_QUERY,matiasjofre,@princessbuddha im having the same problem.. i never drive anymore! 
0,1468606710,Tue Apr 07 02:41:37 PDT 2009,NO_QUERY,Bellalou27,still up... sad i lost followers 
0,1468606953,Tue Apr 07 02:41:42 PDT 2009,NO_QUERY,DrPotatohead,a sad day I morn for my awesome car  http://twitpic.com/2y82e
0,1468607254,Tue Apr 07 02:41:49 PDT 2009,NO_QUERY,jwilger,"OK, I think I'm finally done with work for the (yester)day. Now for a beer and some TV before hitting the sack. Back at it around 9am. "
0,1468607344,Tue Apr 07 02:41:51 PDT 2009,NO_QUERY,sareyk,working my life away.. 
0,1468607647,Tue Apr 07 02:41:59 PDT 2009,NO_QUERY,swarnaparni,examz coming.........really feeling HeLpLeSsSsSs.. 
0,1468607733,Tue Apr 07 02:42:01 PDT 2009,NO_QUERY,ipodque,Creepy Outdoor on the speedway: Alli is now in Portugal... Seems not so good 4 losing weight  not healthy!
0,1468608026,Tue Apr 07 02:42:07 PDT 2009,NO_QUERY,t0xic_honey,"@francesdath not bad, transitioning, being visited by many globe wandering gypsy queers at the moment... but you are missing "
0,1468608080,Tue Apr 07 02:42:08 PDT 2009,NO_QUERY,clevrijx,loaded with the cold  great fun!!!
0,1468608214,Tue Apr 07 02:42:11 PDT 2009,NO_QUERY,Dandreeg,up early. my stomache is acting funny 
0,1468608610,Tue Apr 07 02:42:19 PDT 2009,NO_QUERY,HeyGitta,has a headache...it wont go away and i dont want to od on panadol....lol....seriously though it hurts 
0,1468609133,Tue Apr 07 02:42:31 PDT 2009,NO_QUERY,DaaBuddy,http://twitter.com/freddybust/status/1463411617 - thats right! 
0,1468609298,Tue Apr 07 02:42:35 PDT 2009,NO_QUERY,AmyGrindhouse,"Maybe that was unclear... I'm planning to post on my own website later than usual today, due to technical issues "
0,1468609303,Tue Apr 07 02:42:35 PDT 2009,NO_QUERY,Djalfy,does anyone else miss chatting in chat rooms? I do  but can't find  one i feel comfortable in suggestions please?
0,1468609315,Tue Apr 07 02:42:35 PDT 2009,NO_QUERY,chloroform_tea,"Vah. The dreaded lurgy strikes. I'm in dire need of tea, chloroformed or otherwise. Alas, I'm off to ASDA for pizza, no time for tea "
0,1468609400,Tue Apr 07 02:42:37 PDT 2009,NO_QUERY,anonomi,The leeds festival twitter man has lied. There is no update. 
0,1468609575,Tue Apr 07 02:42:41 PDT 2009,NO_QUERY,darkopevec,"going, going, aaand gone. poor moosie fell asleep in class   http://twitpic.com/2y82y"
0,1468609669,Tue Apr 07 02:42:44 PDT 2009,NO_QUERY,chhlllooooeeeee,is really fed up 
0,1468610045,Tue Apr 07 02:42:53 PDT 2009,NO_QUERY,melinoma,"swapping songs through email with carrie, damn the tasman DAMN IT TO HELL i wanna jam "
0,1468610083,Tue Apr 07 02:42:54 PDT 2009,NO_QUERY,NikkolaD,"damn it, i still can't find a decent sized photo "
0,1468610356,Tue Apr 07 02:42:59 PDT 2009,NO_QUERY,jeremy_ellis,"@Anjeebaby I'm fine if things are busy, just gets hard at quieter times "
0,1468610527,Tue Apr 07 02:43:03 PDT 2009,NO_QUERY,Shelistar,"Essay finished, 3,605 words, very pleased with self but dreading the return to project work "
0,1468610803,Tue Apr 07 02:43:09 PDT 2009,NO_QUERY,Talk_ShowHost,"@VioletsCRUK Yeah, off Aberdeen, on the Miller platform, the one the chopper left before it went down thew other day "
0,1468610982,Tue Apr 07 02:43:13 PDT 2009,NO_QUERY,VictoriaSoguero,immm sooooo lowwww 
0,1468611228,Tue Apr 07 02:43:18 PDT 2009,NO_QUERY,A1nz,"I still feel toss, though I was better yesterday but actually realised im not when I woke up at 5am feeling sick "
0,1468611366,Tue Apr 07 02:43:21 PDT 2009,NO_QUERY,cajnel,Still have a lot of work to catch up on! 
0,1468611643,Tue Apr 07 02:43:27 PDT 2009,NO_QUERY,Labab,...  missed the gig 
0,1468611785,Tue Apr 07 02:43:31 PDT 2009,NO_QUERY,KneeHighBootFan,Khb count low today despite the changing weather. 
0,1468612362,Tue Apr 07 02:43:43 PDT 2009,NO_QUERY,monblain,@dale__wood I love uni coffee????? BET you won't get this one. ILPC oh ps uni tomorrow pick u up at 12:52! PS 1000 word assignment!  ARG
0,1468612843,Tue Apr 07 02:43:54 PDT 2009,NO_QUERY,pr3judice,now I'm having a hard time digesting disappointment 
0,1468612855,Tue Apr 07 02:43:54 PDT 2009,NO_QUERY,kmas0407,READY FOR FRIDAY at the TED!! Go Braves! &amp; stocking up on ricola cough drops &amp; dayquil b.c i have a cold from the constant weather change 
0,1468613026,Tue Apr 07 02:43:58 PDT 2009,NO_QUERY,tankertuig,:S geen How I Met Your Mother vandaag 
0,1468613355,Tue Apr 07 02:44:05 PDT 2009,NO_QUERY,MissNina,No southpark for me 
0,1468614764,Tue Apr 07 02:44:37 PDT 2009,NO_QUERY,henna_,"yay, migraine to round of Berlin "
0,1468617662,Tue Apr 07 02:45:37 PDT 2009,NO_QUERY,emotionlessgal,@SheriTingle Really busy  Loads of projects to complete.
0,1468617783,Tue Apr 07 02:45:39 PDT 2009,NO_QUERY,Deligal,"so much for my roast tonight, still frozen solid. "
0,1468617899,Tue Apr 07 02:45:41 PDT 2009,NO_QUERY,jaredgunter,Up since 3:00. Going to be a looooong day. 
0,1468617912,Tue Apr 07 02:45:42 PDT 2009,NO_QUERY,SophieClaeys,"i'm bleeding ! , i shaved my legs and now i'm bleeding   haha, i'm a loser xp"
0,1468618309,Tue Apr 07 02:45:51 PDT 2009,NO_QUERY,The_Kingfisher,Just got reduced to tears by Jeremy Kyle!! Off to the doctors now  i hate the doctors its so scary! Arghhhh!
0,1468618608,Tue Apr 07 02:45:58 PDT 2009,NO_QUERY,lovelylisaj,I killed the Eggnog thread on PJ with my lame joke 
0,1468618787,Tue Apr 07 02:46:02 PDT 2009,NO_QUERY,lilmissvik,"@tommcfly hey, no chance of adding brighton or eastbourne to the UCAP tour? gutted im missing out this time round  i love you guys!"
0,1468619130,Tue Apr 07 02:46:08 PDT 2009,NO_QUERY,MrSocial,I am really tired but cant go to sleep 
0,1468619422,Tue Apr 07 02:46:15 PDT 2009,NO_QUERY,MeDearDarling,"@saturngirl ha ha ha, *cap doffed*. Okay you are right. Camping in the Cotwolds AGAIN for me.    ;)"
0,1468619872,Tue Apr 07 02:46:24 PDT 2009,NO_QUERY,NikkolaD,"lol, i did that then i was silly and thoght kb was the same as k  so its still not working. i doubt i will ever find one"
0,1468619985,Tue Apr 07 02:46:26 PDT 2009,NO_QUERY,DorkieeAmber,@xoVince pssht! i miss u! u don't respond to me 
0,1468620198,Tue Apr 07 02:46:31 PDT 2009,NO_QUERY,Niczy,@DonnieWahlberg   DONNIE!! when are you coming back to the UK? It's been toooo long  X
0,1468620322,Tue Apr 07 02:46:35 PDT 2009,NO_QUERY,LionelnShana,Went to the dentist today... totally as a last resort... totally broke now too!! God damn the dental industry needs competition policies 
0,1468620341,Tue Apr 07 02:46:34 PDT 2009,NO_QUERY,khanh_coltech,th�m m?t l?n n�i d?i 
0,1468620878,Tue Apr 07 02:46:46 PDT 2009,NO_QUERY,vickibabes91,Off Too Work .Gunna Miss The Lush Weather  .x
0,1468620940,Tue Apr 07 02:46:47 PDT 2009,NO_QUERY,michaelmknight,"@MANDY_EMMERSON Bummer, hope your OK! "
0,1468620963,Tue Apr 07 02:46:48 PDT 2009,NO_QUERY,tantrixie,http://twitpic.com/2y867 - I miss thiss 
0,1468621312,Tue Apr 07 02:46:56 PDT 2009,NO_QUERY,LynnaeG,"Wow, its way too early to be awake.  Lots to do though, and software post at 8:30 so I actually have to be to work on time. Boo..."
